{"$schema":"https://json-schema.org/draft/2020-12/schema","$id":"https://conductor.local/schemas/section-map.schema.json","title":"Ordered section map v2","type":"object","required":["schemaVersion","conductorVersion","framework","sections","rules","ignored"],"properties":{"schemaVersion":{"const":2},"conductorVersion":{"type":"string"},"framework":{"type":"string"},"sections":{"type":"array","items":{"type":"object","required":["id","agent","dependsOn","enabled"],"properties":{"id":{"type":"string","pattern":"^[a-z][a-z0-9-]{0,63}$"},"agent":{"type":"string","pattern":"^[a-z][a-z0-9-]{0,63}$"},"dependsOn":{"type":"array","items":{"type":"string"},"uniqueItems":true},"enabled":{"type":"boolean"}}}},"rules":{"type":"array","items":{"type":"object","required":["owner","glob"],"properties":{"id":{"type":"string"},"owner":{"type":"string"},"glob":{"type":"string"}}}},"ignored":{"type":"array","items":{"type":"string"}},"notes":{"type":"array","items":{"type":"string"}}},"additionalProperties":false}
